date,username,fullname,tweet_id,retweet_count,tweet,favorite_count,sentimiento
2017-03-31 19:33:59,@VeritoRengel,Verónica Rengel Ríos,8.4789476298847E+017,4,"Esa es la miseria humana, son unos desgraciados, no encuentro otro adjetivo más suave para estos miserables.",3,0
2017-03-31 19:33:51,@marcopolodj72,JUMANDY,8.47894729102643E+017,2,.@IsraelCasti15Sigue faranduleando con los bucaram Lo tuyo es #BLN CHEERLEADER  @FeliciaGarzon ,2,0
2017-03-31 19:33:35,@danielpenades,Daniel Penades,8.47894665210864E+017,1,"Democracia (Lasso) o Venezuela (Moreno)? Guerra Civil? Esto es muy SERIO
ECUADOR REACCIONE",1,0
2017-03-31 19:33:32,@CristianIglesi7,Cristian Iglesias,8.47894649796792E+017,1,"El si puede comprar una entrada en palco ! A el, los bancos le depositan por ""ERROR"" cientos d miles d dólares  ",0,0
2017-03-31 19:31:52,@xaviercalva,xavier calva,8.47894232748745E+017,0,Favor tomar en consideración Sres. @LassoGuillermo @andrespaezec @CesarMongeO @CREOEcuador @jovenesCREO ,0,0
2017-03-31 19:30:12,@ecaleonard,Elsa A Leonard,8.47893810982138E+017,2,"No tienen ninguna decencia,estos miserables creen k con $$ sr compran ls salud,k equivocados están, csnsllss escupiendo al cielo",0,0
2017-03-31 19:30:01,@revistaPlanV,Plan V,8.47893765641691E+017,14,"#IdeasPlanV Disyuntiva urgente: la patria o el ombligo
La nueva #Opinion de Luis Verdesoto en: 
#2A #Lasso #Lenin ",8,0
2017-03-31 19:29:35,@camilin86,Camilo Taufic M,8.47893657676112E+017,0,Puse que las elecciones no habían acabado y que no hay que rendirse por una encuesta. Pregunte si no estaba hackeda la pagina de cedatos,0,0
2017-03-31 19:29:12,@elpoliticonews,El Político,8.47893559722332E+017,3,"#Ecuador Lasso desea que seguidores salgan a defender el voto
  ",0,0
2017-03-31 19:29:12,@lucia_luciamar,Lucia Martinez,8.47893558636032E+017,1,Porque llegar a estos extremos gente sin razon sin alma son unos pobres gentes con $$$$$,0,0
2017-03-31 19:25:27,@Boobu0525,Boo Boo,8.47892616482103E+017,3,He visto bájesa y porqueria en esta campaña pero esto ya es miseria humana @LassoGuillermo @Lenin ,0,0
2017-03-31 19:24:10,@caminantealfa,aquiles valarezo,8.47892294502101E+017,1,"Recuerdo el video donde la gente criticó buses con adhesivos de Lenin, y luego alguien tomó 2 fotos de 1 mismo bus con adhesivos de Lasso",0,0
2017-03-31 19:23:47,@Djwarnermix,WARNERMIX PRODUCER,8.47892197970244E+017,0,"MI PROPIA ENCUESTA AQUÍ EN FACEBOOK!!! 
Solo comenta LENÍN O LASSO (sólo interesan votos válidos por cualquiera... ",0,0
2017-03-31 19:23:14,@HinchaFutbol1,Campeonato Nacional,8.47892059419816E+017,0,"Quien gane sea el Sr. @Lenin o el Sr. @LassoGuillermo, solo queremos transparencia, responsabilidad y seriedad, Sr. @JuanPabloPozoB",1,0
2017-03-31 19:23:13,@MarielaReaAbad,Mariela Rea,8.47892056110375E+017,0,Parte 2 Análisis de candidatos y propuestas: Lenin Moreno y Guillermo Lasso ,0,0
2017-03-31 19:22:38,@Amito78,Idolo593™  🌟15,8.47891906856178E+017,0,@darkvader2015 @LassoGuillermo mexicana o ecuatoriana @EbiEbicamacho ??? Esta sera de todo menos de los nuestros,0,0
2017-03-31 19:21:57,@FeliciaGarzon,Felicia Garzon,8.47891735061639E+017,3,Ecuador no necesita ser ningún otro país ingeniero de cartón.. ,3,0
2017-03-31 19:20:00,@elclarinweb,El Clarín,8.47891246190182E+017,0,"12,8 millones de electores en Ecuador están convocados a elegir entre Guillermo Lasso y Lenín Moreno   ",1,0
2017-03-31 19:19:25,@ciudadanos_ec,Ciudadanos Ecuador,8.47891097330365E+017,1,le pides peras al olmo,2,0
2017-03-31 19:18:00,@BettySalvador77,Betty77,8.4789074311714E+017,0,por qué no publicaste lo mismo cuando la propia @cedatos puso a @Lenin arriba de @LassoGuillermo? No te conviene decir la verdad?,2,0
2017-03-31 19:15:32,@sofiaespitia,Sofía,8.47890122800587E+017,1,"-voy a votar por lasso/lenin 
-  ",5,0
2017-03-31 19:15:31,@CamilaM_78,Camila Morales,8.47890114575573E+017,2,Esto es campaña baja... como se pueden hacer estas cosas... No tiene nombre...,0,0
2017-03-31 19:14:17,@marcopolodj72,JUMANDY,8.47889806361285E+017,4,Un retardadita ingeniero industrial que no sabe quien propone industrialización y quien solo ser consumidores ,3,0
2017-03-31 19:12:42,@legm_51,Luis Gualsaqui,8.47889409433383E+017,0,"Quizá no se molesten los que sabemos?, ya que sin él (@andrespaezec),  @monge... y asesoramiento de Tintori, López y Capriles. Estaríamos... ",0,0
2017-03-31 19:11:18,@sanosma,Maya,8.47889056784667E+017,0,También pense así.  Y corregí con el siguiente título Acertada lectura de la realidad de Vargas Llosa,1,0
2017-03-31 19:10:14,@dariogarcia_49,FERNANDO TELLO,8.47888787074155E+017,0,  LASSO CHCHAS,0,0
2017-03-31 19:06:57,@OmbelicoM,Ombelico Del Mondo,8.47887958766178E+017,1,#AHORA | Analizamos el ballotage de este domingo en Ecuador entre @Lenin y @LassoGuillermo por @RadionautaFM FM 106.3 ,1,0
2017-03-31 19:06:14,@Daguezam,David Guerrero,8.47887781980504E+017,0,".@cnegobec, @LassoGuillermo, @OEA_oficial, @unasur... Alguien por favor que le expliquen a estos jóvenes que estamos en veda electoral. ",0,0
2017-03-31 19:04:59,@LassoTeam,LassoTeam,8.47887467248275E+017,2,VOTA por @LassoMusica como Mejor Artista Rock - Lasso   en los #premiosheat,0,0
2017-03-31 19:03:53,@the_lastestnews,Davide Calusi,8.47887188679328E+017,0,Opositor Lasso reclama cambio en Ecuador en cierre de campaña - Diario las Américas ,0,0
2017-03-31 19:03:07,@oosorio647,Osvaldo Osorio,8.47886997196865E+017,0,Guillermo Lasso cuenta con atmósfera regional para ganar pero figura de Lenin Moreno aún puede salvar muebles de la izquierda. #ecuadorelige,0,0
2017-03-31 19:02:18,@VDJRoccoso,David Bohorquez Z.,8.47886790384128E+017,0,Todos aqui en fb preguntando lasso o lenin era que se hagan encuestadores... jajajaja cedatos estaba cogiendo personal ,0,0
2017-03-31 19:01:09,@lizverdesoto,ELIZABETH VERDESOTO,8.47886501983728E+017,0,De la misma manera que será juzgado Lasso por evadir impuestos,0,0
2017-03-31 19:00:34,@legm_51,Luis Gualsaqui,8.47886355459973E+017,0,"Mis panas, voto incondicional!!! Y, las Bases? Ellos tienen que seguirnos, así no lo queran, los tenemos ciegos, sordos y engañados. ",0,0
2017-03-31 18:57:01,@JusticieroEc21,Justiciero Ecuador,8.47885462970696E+017,8,"Resultados de las carceles coinciden con enc. de Cedatos cerrado el 30 de marzo a las 23h50:
Guillermo Lasso: 52,47%
Lenin Moreno: 47,35%",7,0
2017-03-31 18:56:20,@JoelQC_,Joelito,8.47885288655532E+017,1,"En el mismo gajo de panas hay seguidores de Lasso y correistas, espero que terminen tomándose unas cervezas y dándose la mano, como panas.",1,0
2017-03-31 18:52:35,@kobedjmusic,kobedjmusic,8.47884346493108E+017,1,"De zaragoza molan los adoquines, el @LifeTemptation_ , su gente...zaragoza es mas grande que pluton!! @miguelroblesdj estas conmigo?",8,0
2017-03-31 18:51:12,@sebashurtado,Sebastian Hurtado,8.47883997753598E+017,2,"Lo van a llamar igual si @LassoGuillermo hace lo mismo en #Ecuador?
#Venezuela ",0,0
2017-03-31 18:50:22,@JoaquinMachi1,Joaquín,8.47883789053419E+017,0,logan obvio,1,0
2017-03-31 18:48:39,@veroniqueord,Veronique Ordoñez,8.47883355769188E+017,3,  @Lenin  REVOLUCIONARIOS RECHAZAMOS LA VIOLANCIA SU CANDIDATO @andrespaezec DEBERIA HACER LO MISMO @LassoGuillermo,4,0
2017-03-31 18:48:37,@MarielaReaAbad,Mariela Rea,8.47883347871154E+017,0,Análisis de candidatos y propuestas: Lenin Moreno y Guillermo Lasso ,0,0
2017-03-31 18:46:53,@Coffidi,Camila Proaño,8.47882909960872E+017,0,"En cobertura en restaurante de comida típica escucho a una mesa de comensales hablando del tema del estadio, las agresiones y Lasso.",0,0
2017-03-31 18:43:43,@MiguelSonrie,TE AMO ECUADOR.,8.47882112464237E+017,0,"Pidió incendiar el estadio por si acaso,o colgó ahorcando una figura de Lasso?Porque Páez esta identificado junto a  concejal el mismo 19A  ",0,0
2017-03-31 18:40:36,@PatthyMunoz,DoulaPatthyMuñoz,8.47881328573993E+017,2,Esto solo pasa con la revolución @EligeEcuador @mujereslibresec @LassoGuillermo  ,1,0
2017-03-31 18:40:14,@elinformadorweb,El Informador Web,8.47881238560084E+017,4,Guillermo Lasso pide a los ecuatorianos defender el voto en las calles ,3,0
2017-03-31 18:39:20,@pxart,Patrick,8.47881010075369E+017,1,"MARKET 
AL 28/03/17
LASSO 51.2%
LENIN 49.7%
INDECISIÓN 9% 
MARGEN DE ERROR +-2%",0,0
2017-03-31 18:38:43,@elpoliticonews,El Político,8.47880854277849E+017,1,"#Ecuador Correa rechaza agresión a Lasso pero asegura que opositores generan violencia
  ",1,0
2017-03-31 18:36:30,@RAFAELSALAZAR82,RAFAEL SALAZAR,8.47880295940588E+017,1,doña florinda,1,0
2017-03-31 18:35:37,@angellobarahona,Angello Barahona,8.47880076934775E+017,1,El Palacio de Carondelet tendrá nuevo inquilino desde el 24 de Mayo del 2017. Lenin o Lasso.…  ,1,0
2017-03-31 18:33:19,@galomunozg49,Galo Efrain Muñoz Go,8.47879498305614E+017,1,Uds que dicen tener cultura que se puede esperar de la gente que es fanática de lasso y de Lenin nada bueno más coherencia sres comunicadore,0,0
2017-03-31 18:33:16,@brisipin,Briseida Pinto,8.47879485059981E+017,1,"Lo compara con Correa? Por favor  y no cree q se extralimitó? Desde su crítica lo sigue empeorando, humildad es reconocer errores",3,0
2017-03-31 18:32:34,@jorgevillacrese,Jorge Villacreses G,8.47879306638483E+017,0,Carlita mi solidaridad contigo #Alguacil @PPSE,1,0
2017-03-31 18:32:13,@VictorHugoVII,VERDAD EN PERIODISMO,8.47879217874424E+017,1,"Urgente: Dos mujeres Asaltan al primer ministro de canada.Basada en la descripción racista de Lasso,Paez y @CREOEcuador ",1,0
2017-03-31 18:32:10,@110010010011010,Pouer,8.47879208076534E+017,3,Así es Lasso:  ,2,0
2017-03-31 18:31:25,@brisipin,Briseida Pinto,8.47879020066877E+017,0,"Soy fiel a mis principios nunca los vendo ni cambio por nada, habla de pedir humildad y control a LASSO? Lea su carta otra vez, en voz alta",1,0
2017-03-31 18:30:32,@stalinsancan,Stalin Sancán,8.47878798284648E+017,0,"De un argentino a los simpatizantes de Lasso y a los Ni-Ni
Publicado el Jueves 30 de Marzo de 2017 en OPINIÓN... ",0,0
2017-03-31 18:30:12,@Hora25Ec,Hora 25 Ecuador,8.47878712494359E+017,39,¿Zona Franca de Turismo? ¿A quién beneficia? Guillermo Lasso lo explicó así en #Hora25  ,31,0
2017-03-31 18:29:16,@dennisllerena11,Dennis Llerena,8.47878475625181E+017,2,@SoldadaLasso @francofer1 @jlogroniv me ayudan con un RT por favor y miren el video @andrespaezec @LassoGuillermo  ,3,0
2017-03-31 18:24:19,@Roderikus,Rodrigo Aguilar O.,8.47877230025998E+017,0,Binomio Lasso-Páez cerró campaña insistiendo en movilizaciones para el 2A  vía @el_telegrafo,0,0
2017-03-31 18:24:13,@CpalaguachiP,JPatrick CPalaguachi,8.47877208035275E+017,0,no se si en la imagen de la playa es una abuela o Lasso :v ,0,0
2017-03-31 18:22:18,@mruizacosta1,Miguel Ruiz,8.47876725983728E+017,1,Lasso se niega a dar explicaciones sobre sus negocios financieros | Las mamushkas financieras de Lasso  vía @Pagina12,2,0
2017-03-31 18:22:05,@lepamagu,Leonardo Maza,8.47876671344718E+017,0,"Vamos Lenín 

Tracking diario muestra ventaja de Lenín Moreno de 16 puntos sobre Guillermo Lasso ",0,0
2017-03-31 18:20:07,@Buzzmometer,Buzzmometer,8.47876174151913E+017,0,Lenín se asocia a “gobierno corrupto· y Lasso a “feriado bancario”  #EleccionesEc2017 #2A,0,0
2017-03-31 18:20:00,@elclarinweb,El Clarín,8.47876146729333E+017,0,Guillermo Lasso y Lenín Moreno ponen fin a campaña electoral en Ecuador   ,0,0
2017-03-31 18:14:43,@Gitormentosa,GiTormentosa ⚡,8.47874815788765E+017,16,"Así mismo acá en Mendoza, Argentina tenemos que viajar a Buenos Aires para votar teniendo acá un consulado pero no hay q viajar por 190 usd",3,0
2017-03-31 18:13:58,@brisipin,Briseida Pinto,8.47874627800097E+017,1,"Insisto usted se lo buscó, acepte su error y responsabilidad en esto",0,0
2017-03-31 18:11:23,@campoverde_3,Carlos Eduardo,8.47873978970583E+017,0,Dios quiera que así sea.,1,0
2017-03-31 18:10:54,@manuelvillavi30,Manuel Villavicencio,8.47873856333382E+017,1,"Tracking poll de Cedatos cerrado jueves 30 en la noche: 52,47% Guillermo Lasso  vs. 47,35%. Moreno. Confirmado",3,0
2017-03-31 18:08:35,@jonathanasdruba,Asdrubal,8.47873271471239E+017,0,"@LassoGuillermo @Lenin  ahi cada quien saque sus conclusiones, de futbol al menos si entienden #2a es Democracia ",0,0
2017-03-31 18:07:23,@pflovator,Patricio Lovato,8.47872968906744E+017,0,Reiteró si quieres que te sigan considerando Perid correcto de frente di que estas por Lasso y No invites a leer cierta prensa corrupta,1,0
2017-03-31 18:06:26,@America24Horas,América 24Horas,8.47872730775134E+017,0,@LassoGuillermo llama a votar por el cambio y promete crear un millón de empleos  @andrespaezec @CREOEcuador ,0,0
2017-03-31 18:05:40,@nchauvina,Nathalie Chauvin,8.47872536939573E+017,0,"Estimado @HectorYgonet interesantes los datos, pero me parece que le hace falta la fuente,así como el peso de votos válidos a nivel nacional",0,0
2017-03-31 18:05:06,@LassoAragua,Fans Club Aragua,8.47872394563867E+017,0,NUEVO VIDEO de @LassoMusica y @sherylrubior28 TRATANDO DE ESCAPAR (VLOG)  - Sheryl y Lasso  ,0,0
2017-03-31 18:05:04,@pisanati,Patty,8.47872389086163E+017,2,"Si ni siquiera hay cónsul que represente. Si no ha cambiado, el cónsul ahí es ad honorem.",1,0
2017-03-31 18:04:35,@El_Mapero,Jorge Coronel,8.47872264095846E+017,2,"Excelente y bien argumentado, lastimosamente salió tarde y como respeto el silencio lectoral, de ahí que no lo comparto en redes.",1,0
2017-03-31 18:04:05,@pronto_express,Pronto Express,8.47872141559185E+017,0,Horas decisivas en Ecuador: Moreno y Lasso cerraron sus campañas y el continente se muestra ...: Con una economía… ,0,0
2017-03-31 18:01:41,@Idavart,Riesgo poético,8.47871537285927E+017,0,Ecuador a segunda vuelta: cómo sería el futuro con Lasso - En una serie televisada hace algunos años con el nom... ,0,0
2017-03-31 18:00:35,@InfoNodal,Nodal,8.47871260977746E+017,4,#EcuadorDecide: últimas entrevistas a los candidatos @Lenin y @LassoGuillermo de cara al balotaje de este domingo  ,5,0
2017-03-31 18:00:34,@betomer1208,betomer1208,8.47871253583208E+017,0,"Si agredieron a Lasso está mal, pero también esta acción es repudiable. Será que esto no es condenable porque va en contra de su candidato  ",0,0
2017-03-31 17:59:48,@MAZZAPA,MACARIO ZABALLOS,8.47871061173645E+017,0,"
Más de 3.500 familias ecuatorianas de la Región se juegan su asesoría hipotecaria ""si gana Lasso"", según Guerrero.",0,0
2017-03-31 17:59:04,@macas_virtual,Macas Tecnológico,8.47870878000063E+017,0,ECUADOR CHEQUEA a Guillermo Lasso ,0,0
2017-03-31 17:58:57,@ObservadorUY,El Observador,8.47870847394108E+017,1,El oficialista Moreno y el derechista Lasso se medirán el domingo  ,1,0
2017-03-31 17:57:49,@macas_virtual,Macas Tecnológico,8.47870561036513E+017,0,Perfil de Guillermo Lasso. Cortesía CNN en Español ,0,0
2017-03-31 17:57:07,@NubiaFarias7,lluviacomolluvia,8.47870384686944E+017,0,"Ahora Lasso en nuestra mejor opción   , haces unos meses era  Viteri.
¿Si quieren el cambio  por que  desde un principio no se unió a Lasso?",3,0
2017-03-31 17:54:31,@leomechas,Eг Coʁƨɑʁιo ∀znг,8.47869734242718E+017,0,La dirección es:  Calle 38 # 5-14 y Carrera 5. Dentro de la ciudad amurallada (Centro histórico). A la vuelta de Teatro Heredia. ,0,0
2017-03-31 17:54:27,@RooyRS,Roy Richards,8.47869715078947E+017,0,"Tuiter no gana unas elecciones, no hacen nada escribiendo. Todos sabemos q los q se creen influencers están a favor de Lasso por el ",1,0
2017-03-31 17:54:23,@andreschiri84,Andrés Chiriboga T.,8.47869698029093E+017,6,Les comparto este texto que escribí a propósito del último tramo de la campaña de Lasso y el manejo de sus capitales  ,5,0
2017-03-31 17:54:16,@familiasociedad,Familia & Sociedad,8.47869669440713E+017,0,"Les sacó la plata a los sociolistos, formó su partido, se afianzó políticamente y ahora habla mal de los populistas y habla bien de Lasso …",0,0
2017-03-31 17:53:39,@alomedellin1,Alirio Cano Montoya,8.47869515144868E+017,0,"En Ecuador:con elección del candidato,Guillermo Lasso,se rompe el cordón umbilical que une al Gobierno de Correa con el régimen de Maduro.  ",0,0
2017-03-31 17:53:09,@RealGallipoli,J. Angel Gallipoli,8.47869388812407E+017,0,"Bailoterapia y concierto de Lasso, Apache, Nacho y Víctor Muñoz... así terminara eso.  ",1,0
2017-03-31 17:52:46,@macas_virtual,Macas Tecnológico,8.47869290363711E+017,2,Guillermo Lasso fue agredido en Estadio Olímpico Atahualpa ,0,0
2017-03-31 17:51:59,@PauliMont,jaulix,8.47869094317748E+017,0,Es obvio a quien te refieres. El ambiente está tenso y todos nos equivocamos pero mejor dejar ahí.,3,0
2017-03-31 17:50:35,@libeinter,Libe Internacional,8.47868744248459E+017,0,Opositor Lasso reclama cambio en Ecuador en cierre de campaña - Diario las Américas ,0,0
2017-03-31 17:47:33,@PauliMont,jaulix,8.47867980180582E+017,1,Usó la misma vía que tu usaste Karla. Como amiga te lo digo que esta no es la forma ni de solucionar roces ni de ayudar al país.,4,0
2017-03-31 17:44:58,@freddybonilla,FreBoNar,8.47867328960311E+017,1,"YO Y NADIE LE CREE NADA A ESA SRTA CAMACHO. 
OJO Y CUIDADO.",3,0
2017-03-31 17:42:55,@chivi_1987,Gaetano Leone,8.47866813719433E+017,0,"Juventus y Lasso, el resto voto nulo  ",0,0
2017-03-31 17:42:33,@leomechas,Eг Coʁƨɑʁιo ∀znг,8.47866721012679E+017,6,.@LassoGuillermo  A los hermanos ecuatorianos que residen en Colombia. Sólo pueden votar en Bogotá. En ninguna otra ciudad de Colombia.,2,0
2017-03-31 17:41:30,@ClubMktFCA,Club de Marketing,8.47866456373174E+017,0,"Retweeted Garzón-Lasso (@alexgarzon_):

¿Qué es eso llamado “Endomarketing”?  vía...",0,0
2017-03-31 17:41:16,@Kaeltikx,Kaéltikx,8.47866398927798E+017,0,Ecuador: Binomio derechista Lasso-Páez cerró campaña insistiendo en movilizaciones para el 2A  #Rentsoc ,0,0
2017-03-31 17:40:24,@leomechas,Eг Coʁƨɑʁιo ∀znг,8.47866180815729E+017,54,".@LassoGuillermo Encontré el consulado de Ecuador en Cartagena, Colombia. Y nadie va a votar ahí, tienen que ir a Bogotá. En toda Colombia!  ",16,0
2017-03-31 17:40:24,@Javi01_83Ptt,Javi Padilla,8.47866178169123E+017,0,"Excelente vídeo, la muestra de un verdadero empresario @CAMILOPONCE26 @Alberto32659286",2,0
2017-03-31 17:39:55,@agtv22,agtv22,8.47866057905906E+017,0,amén !!!,1,0
2017-03-31 17:39:48,@teleradio1350,teleradio,8.4786602909517E+017,1,"#Política
Guillermo Lasso cerró campaña en el coliseo Paladines Polo insistiendo en movilizaciones para el 2A  ",1,0
2017-03-31 17:38:24,@MinergiaEC,Revista MINERGÍA,8.47865678120055E+017,7,"Entrevista a Guillermo Lasso: ""Reconocemos el valor de la minería responsable para el crecimiento de la economía"" ",3,0
2017-03-31 17:38:24,@Politik_ec, 📌,8.47865676492673E+017,9,"De la boquita de Viteri, eso es Lasso y ese selecto grupo de empresarios @FernandaFebC @Supercaucho @FFHeredia @MashiRafael ",4,0
2017-03-31 17:38:15,@TiagoNihil,Santiago Val C.,8.47865637947023E+017,0,"Al sr. Ramonet solo le faltó decir que Lasso a parte de Opus Dei es también satánico y huele a sobaco...(Periodismo objetivo, le dicen)",0,0
2017-03-31 17:38:04,@JohnnyQuijanoG,KIKANO 4X4 MANABA 😘,8.47865594015871E+017,3,"CEDATOS,  empresa encuestadora, la más seria del país, es la se aproxima a la realidad. Inclusive le aumentaría 3 puntos más a Lasso ganador  ",1,0
2017-03-31 17:36:17,@JoseLuisCobaH,JLC,8.47865145434964E+017,2,"si es que no quiere politizar el tema, xq menciona a LENIN? Debería ofrecerse usted a ayudar al club q dice ser hincha, desinteresadamente.",1,0
2017-03-31 17:35:34,@JoJWeeab0oTrash, 🔴JapanWeeabooKailer,8.47864964492743E+017,0,Lasso - Hoy Te Dejo De Amar (Lyric)   vía @YouTube,0,0
2017-03-31 17:35:00,@CCNesnoticias,ConcienciaEsnoticias,8.47864822418952E+017,1,Guillermo Lasso pide a los ecuatorianos defender el voto en las calles ,1,0
2017-03-31 17:34:18,@Andreilate,Andre Fernández,8.47864643330728E+017,0,"Y ahora me van a empezar a atacar los trolls de Lasso? ja ja ESTOY DE SU LADO PANAS pero no jodan, si hacen algo mal igual voy a criticar.",0,0
2017-03-31 17:33:27,@javi_andres,Javier Arellano,8.47864431111524E+017,0,Periodista argentina fue amedrentada en acto de Lasso   vía @YouTube,0,0
2017-03-31 17:33:19,@GloriaB2B,Gloria B.,8.47864396734968E+017,1,"Opositor Lasso reclama cambio en Ecuador en cierre de campaña 

",0,0
2017-03-31 17:32:28,@LuisaGonzalezEc,Luisa González,8.47864181177057E+017,3,La FIFA prohíbe que la política invada al fútbol como sucedió en Ecuador con Guillermo Lasso ,2,0
2017-03-31 17:32:12,@CarlosLuis_GYE,Carlos Luis Torres R,8.47864117364904E+017,0,"¡Excelente! El siguiente mito a desmitificar: ""los países pobres lo son por sus élites, y NO por su clase pobre."": ",0,0
2017-03-31 17:31:49,@rocyalbarrang,Rocy,8.47864017821381E+017,0,Ecuador a segunda vuelta: cómo sería el futuro con Lasso  ,0,0
2017-03-31 17:30:40,@carodiazpicon,Carito,8.478637315142E+017,0,"Si esto es lo que dicen que es el #Cambio que representa @LassoGuillermo, no me interesa ser parte de él @eluniversocom @CNNEE ",0,0
2017-03-31 17:30:07,@SeInformativa,Señal Informativa,8.47863589947925E+017,1,"#SeñalGlobal
Lasso pide “cambio” en Ecuador para evitar rumbo de Venezuela.  ",1,0
2017-03-31 17:28:37,@00dav00,david revelo,8.47863214650077E+017,0,"#ConLucio ya estabamos en el mundial :/
@LassoGuillermo @Lenin",1,0
2017-03-31 17:28:23,@EditorEnBici,Editor en Bici,8.47863153937568E+017,0,Pero @LassoGuillermo ya mismo le hace la competencia.  ,0,0
2017-03-31 17:28:21,@zemogh,Henry F. Gómez M.,8.47863146219962E+017,0,"Y este es el documento traducido sobre Lasso.

Mientras Ecuador se dirige hacia la segunda ronda de sus... ",0,0
2017-03-31 17:27:36,@Patasyhuellas,Patas & Huellas,8.47862956465549E+017,0,sigue #lolasinfrenos sigue tuiteando te sobran dos dias! Ya se sabrá quién eres!,1,0
2017-03-31 17:26:11,@HAWAYAN25,JUSTICIA Y VERDAD,8.47862602915086E+017,0,"Más imbécil que está sinvergüenza-> @lolacienfuegos  no ha de haber en todo el planeta, el cerebro de esta tipa no terminó de formarse bien",0,0
2017-03-31 17:25:38,@mujereslibresec,mujereslibres,8.47862461927653E+017,2,Creo q todos estamos cansados de confrontaciones de peleas . No nos dejemos llevar por estos momentos tensos . Ecuador nos necesita unidos,4,0
2017-03-31 17:25:01,@zemogh,Henry F. Gómez M.,8.47862308072296E+017,0,Lo que no informa la prensa libre e independiente sobre Lasso ,0,0
2017-03-31 17:24:34,@bermeojp,Juan Pablo Bermeo,8.47862194503025E+017,3,"Comunicación x intereses, pa tenernos ignorantes. Han dicho algo los q sabemos de crisis en Arg? De Lasso y sus triquiñuelas offshore?  ",0,0
2017-03-31 17:23:38,@Ukhoum,UKHOUM,8.47861960838447E+017,0,"Hablas de respeto y que dejen agresiones, cuando lo único que veo en tu twitter son cosas despectivas hacia otros seres humanos!mal educada.",0,0
2017-03-31 17:21:45,@gusfalconi,Gus Falconi,8.47861487104381E+017,0,Nick Nanauer no es el fundador de AMAZON. Fue el primera persona no de la familia de Bezos (Fundador de AMAZON) que puso un capital en AMZ,0,0
2017-03-31 17:21:28,@legm_51,Luis Gualsaqui,8.47861416036115E+017,0,"""¡Un aluvión de ofertas!"" |El @elcomerciocom Financiamiento de @LassoGuillermo con los 14 impuestos notariados que va a derogar  ",0,0
2017-03-31 17:21:14,@PichiPatria,PichiPatria,8.47861356548194E+017,1,"Que el pueblo ecuatoriano vote a conciencia de lo que hay en juego.Y que ese voto sea masivo, pues de ganar Lenin c/poco,denunciarán fraude.",0,0
2017-03-31 17:20:06,@DLasAmericas,Diario Las Américas,8.47861072417759E+017,5,Opositor Lasso reclama cambio en #Ecuador en cierre de campaña,1,0
2017-03-31 17:19:04,@brisipin,Briseida Pinto,8.47860811011961E+017,0,"Disculpe Sra. usted se ganó esa respuesta, a parte de desacertado su comentario es hasta discriminatorio, nada puede coartar la libertad!",4,0
2017-03-31 17:18:54,@drabrahamvillab,Abraham Villa,8.47860770734002E+017,0,"Guillermo Lasso, pide ""un cambio"" para que el país andino no siga el camino de Venezuela #EleccionesEc2017 @LassoGuillermo",1,0
2017-03-31 17:18:30,@Enriquez20Silva,enrique2012,8.47860668233638E+017,0,"La Palabra de DIOS,dice:que El quita y pone reyes ;desde ya en nombre a quien sirvo mi Señor Jesús,ruego a DIOS,que El ,ponga el presidente",0,0
2017-03-31 17:18:27,@macas_virtual,Macas Tecnológico,8.47860654098838E+017,1,Guillermo Lasso y Lenín Moreno cierran campaña con concentraciones ,0,0
2017-03-31 17:17:49,@joseduardosky,José Eduardo Ochoa C,8.47860497236079E+017,0,"Que Lógica más retorcida, falso jamás haremos eso !",2,0
2017-03-31 17:17:34,@HonoSantistevan,Honorio Santistevan,8.47860431540687E+017,0,"31/3/17 12:15:10: Ing Raul Arias: Gano Lasso en las carceles52,47% vs 47,35% gana la Republica !! cerrada",0,0
2017-03-31 17:17:18,@lolacienfuegos,LOLA CIENFUEGOS,8.47860367418159E+017,239,"""Los ricos no crean empleos"" por Nick Hanauer, fundador de AMAZON.
 

cc// @lassoguillermo @lenin @mashirafael",131,0
2017-03-31 17:17:10,@amezcuadf,Cuauhtémoc Amezcua,8.47860333855347E+017,1,"Lasso, neoliberal, realiza campaña sucia.
Elecciones en Ecuador: Análisis de las estrategias electorales ",1,0
2017-03-31 17:16:30,@nataliavaloc,Natalia Valverde,8.47860166817133E+017,0,Entonces dígame cuál es el lugar de la esposa de un presidente? Ubíqueme por favor!,5,0
2017-03-31 17:16:12,@Maquicentro_ec,Maquicentro,8.47860090170479E+017,0,"Encuentranos en #GUAYAQUIL: Av. Juan Tanca Marengo Km 1,5
#QUITO: Av. Galo Plaza Lasso y Sebastian Moreno
#LoTenemosTodo #Valtra #Ecuador ",1,0
2017-03-31 17:13:38,@Me_Lumen,DESPIERTA!,8.47859443744244E+017,2,"Otro video de Lasso siendo agredido 
  ",2,0
2017-03-31 17:12:27,@macas_virtual,Macas Tecnológico,8.47859144879211E+017,0,Guillermo Lasso recibe respaldo de otras organizaciones para control electoral ,0,0
2017-03-31 17:11:50,@KuyaySapi,Moji_gatos,8.47858991820571E+017,1,Cuando alguien me dice que piensa votar por Lasso...  ,1,0
