date,username,fullname,tweet_id,retweet_count,tweet,favorite_count,sentimiento
2017-03-31 21:33:17,@FAElTao,EL TAO,8.47924786240127E+017,0,"Verguenza @MashiRafael @Lenin @35PAIS  ECUADOR SE CANSÓ DEL SOCIALISMO COBARDE Y DICTADOR, COMO EL ASQUEROSO COMUNISMO ",0,-1
2017-03-31 21:32:48,@KojudoReloaded,KojudoReloaded,8.4792466704221E+017,2,"¡Féminas de mi patria, con @Lenin os espera esto porque #LeninEsViolencia #LeninEsMaduro Meditad vuestro voto! ",1,-1
2017-03-31 21:32:22,@johnnyorland,orlando navarro,8.47924554785862E+017,1,hasta ayer no era la campaña porq siguen escribiendo en las redes sociales... Ya cansan,3,-1
2017-03-31 21:30:27,@TomyOrtiz97,Tomy Ortiz Cuero,8.47924071950152E+017,0,Prensa corrupta vendedora de Patria. El apoyo fue para #LeninPresidente.@MashiRafael @Lenin @JorgeGlas #JovenesConLenin. ,1,-1
2017-03-31 21:30:00,@jorasquin,guido jalil,8.47923961153413E+017,107,Raúl Castro retira apoyo a Lenin Moreno porque dice es tan bruto como Maduro ya no hay cabida para ellos. Comunismo deja quebrado Ecuador,52,-1
2017-03-31 21:28:41,@turboyucas,alan alarcon,8.47923630138958E+017,0,"""Lenin estaría sorprendido de encontrarse convertido en momia"" dice su biógrafo   via @ActualidadRT",0,-1
2017-03-31 21:27:07,@BELLEZASLDUQ,BELLEZASLIGADEQUITO,8.47923233684951E+017,0,"LA COINCIDENCIAS DE LA VIDA, QUINTEROS AL IGUAL QUE LENIN EN GINEBRA GANAN 1.6 MILLONES Y NINGUNO HIZO NADA PARA COBRAR ESE DINERO",1,-1
2017-03-31 21:26:55,@Plasmatico,Plasmático,8.47923183340708E+017,1,"#VotoEnCasa
Venezuela
#GolpedeEstadoEnVenezuela
¡𝐀𝐋𝐄𝐑𝐓𝐀! 𝐅𝐔𝐓𝐔𝐑𝐎 𝐃𝐄 #ECUADOR 𝐃𝐄 𝐆𝐀𝐍𝐀𝐑 #LENIN 𝐄𝐋 𝐏𝐑Ó𝐗𝐈𝐌𝐎 𝐃𝐎𝐌𝐈𝐍𝐆𝐎.
 ",0,-1
2017-03-31 21:26:15,@marcoandres1983,|\/|@rk0 @n|)r$,8.47923017338544E+017,0,No sé a Uds.. pero en líneas generales la manera de hacer política en el país me genera VERGÜENZA AJENA.. @Lenin @CesarMongeO @MashiRafael,0,-1
2017-03-31 21:26:05,@FAElTao,EL TAO,8.47922976033051E+017,0,"@Lenin sabemos bien que nos falta y lo que nos sobra, y en 10 años de falacia revolucionaria AQUÍ sobran ustedes @35PAIS #MuerteAlSocialismo ",0,-1
2017-03-31 21:25:14,@radiocolosal,radio colosal,8.47922762685358E+017,0,Lenín Moreno: ¿acaso Venezuela no es el modelo?    ,0,-1
2017-03-31 21:25:11,@PabloSantillanP,Pablo Santillán P.,8.47922750022931E+017,1,Los perros con @Lenin  ,3,-1
2017-03-31 21:24:50,@jorasquin,guido jalil,8.47922660520731E+017,33,Raúl Castro pone a Padrino en Venezuela y no confía en Lenin Moreno en Ecuador xq es otro Maduro Retiro estratégico de Ecuador país quebrado,14,-1
2017-03-31 21:23:59,@BELLEZASLDUQ,BELLEZASLIGADEQUITO,8.4792244456847E+017,0,"LENIN HA SIDO BUENISIMO PARA CONTAR CHISTES, HACE SILENCIO COMPLICE DE AUTOGOLPE EN VENEZUELA, Y SACA #MisionDemocracia jaja caretuco jajaja",1,-1
2017-03-31 21:23:32,@LegalAdvice2014,Legal Advice,8.47922335088865E+017,2,"TUS MATONES @Lenin 

Para esto quieren seguir en el poder @MashiRafael? 
MUERTE CRUZADA?! AUTO GOLPE?!!
#AProsiónGlas
@ngcplc ",1,-1
2017-03-31 21:21:53,@leomechas,Eг Coʁƨɑʁιo ∀znг,8.479219186154E+017,1,Porqué no le hace personalmente Lenin esa pregunta en  un  debate frente a frente?,1,-1
2017-03-31 21:19:26,@jorasquin,guido jalil,8.47921299464782E+017,58,Santos manda tanques guerra frontera con Venezuela.Maduro está en La Habana solo falta que Lenin Moreno ficha Castro en Ecuador viaje a Cuba,17,-1
2017-03-31 21:17:03,@LibroLenin,Lenin&Totalitarismo,8.47920700207899E+017,13,"NOVEDAD Presentación Libro: LENIN Y EL TOTALITARISMO, del escritor @MauricioRojasmr. Miércoles 5 de abril 19.00 h. @fppchile @megustaleercl ",9,-1
2017-03-31 21:15:28,@wasegar77,was 77,8.47920301686104E+017,0,Si ud debe viajar a votar en otra provincia y su voto será por Lenin. Mejor no viaje...,0,-1
2017-03-31 21:13:49,@RedComunismo,Red Comunismo☭,8.47919887112704E+017,3,"Obtuvo  la Orden de la Revolución de Octubre,la Orden de Suvórov y  5 veces la Orden de Lenin",5,-1
2017-03-31 21:13:34,@LegalAdvice2014,Legal Advice,8.47919826312069E+017,2,"TUS compinches encubridor @Lenin 

Para esto quieren seguir en el poder @MashiRafael? 
#AProsiónGlas ",0,-1
2017-03-31 21:11:03,@whyso_serious7,Carlos M. González,8.4791918982219E+017,0,Lenin dice que va a quitar las salvaguardias porque eso de tildarte de traidor por comprar útiles escolares en Colombia es muy correísta.,0,-1
2017-03-31 21:09:50,@Edward_Coke,Edward Coke,8.47918886582464E+017,136,Todos los países democráticos de América Latina están retirando sus embajadores de Venezuela. Maduro está por caer. Lenín tiene miedo,99,-1
2017-03-31 21:08:36,@miguerebelde,Miguel Mateo,8.47918574832374E+017,1,"Este Lenin es mamarracho, una década de agresiones, juicios, insultos, cárcel, por parte de su gobierno y ahora pide paz. Sopenco mentiroso  ",0,-1
2017-03-31 21:08:22,@svergara,Sofia,8.47918515059294E+017,2,Eso debio haberselo dicho a @MashiRafael  hace mucho! Han dividido al #Ecuador y el pueblo les castigara el domingo.,3,-1
2017-03-31 21:05:35,@Anonymous_Ecudr,Anonymous Ecuador,8.47917817043181E+017,2,"Ecuatorianos que llenaron los formularios para las casas , así se burla de ustedes Lenin y Alianza PAIS ",1,-1
2017-03-31 21:04:25,@crodriguezm17,C.Rodriguez M.,8.4791752371048E+017,1,"Una señal evidente que el fraude es la única alternativa que tienen Correa, Lenín, Glas y el resto de la banda, para escapar de la justicia",1,-1
2017-03-31 21:02:34,@schonekatzen,Ma Isa Schonekatzen™,8.47917058142741E+017,2,"Doña Wendy Valverde no le vaya a estar dando el voto al Lenin... Verá, que ya valió madres su plan ternura  ",0,-1
2017-03-31 21:00:48,@EstBanguera,Alfredo Banguera Est,8.47916612762075E+017,0,vamos por el cambio Lasso presidente no queremos ser otro Venezuela,2,-1
2017-03-31 21:00:26,@LegalAdvice2014,Legal Advice,8.47916519552057E+017,1,"TUS MATONES @Lenin
#AProsiónGlas
@ngcplc ",0,-1
2017-03-31 20:59:39,@_tanodiluca_,CARLITO BRIGANTE 💯,8.47916323715916E+017,1,La única manera que gane Lenin él domingo es con fraude y hay que estar preparado para lo que se venga,0,-1
2017-03-31 20:58:40,@richierey1,R I C H I E - R E Y,8.47916076772074E+017,4,"—Oye dicen que están botando a la basura los formularios d las casas q Lenin hace llenar.
—¿Yo te dije créele a esas ratas de alianza país?.  ",1,-1
2017-03-31 20:56:42,@teruru1046,Tere,8.47915578962698E+017,1,Si llegase a perder Lenin se lo atribuyo al opa de Maduro.,11,-1
2017-03-31 20:55:59,@altersonyyy100,RacuminPalComunismo,8.47915400633496E+017,0,EL SOLO QUERÍA EL TRONO DE LOS BORREGOS  ,1,-1
2017-03-31 20:55:05,@carmenzobeyda,Carmen VásqQs,8.47915172505285E+017,0,No quiero mas violencia para mi pais. Paz libertad y democracia. No mas insultos odios y division en las sabatinas. Ya no. Ya no mas!!!,1,-1
2017-03-31 20:55:01,@mmajimenez,jajajajaja,8.47915154985669E+017,1,Una persona que apoya la dictadura demuestra que es peligroso ni loco regalo mi voto por usted,0,-1
2017-03-31 20:54:34,@hectorcede1981,Ettore,8.47915041592668E+017,0,"y por qué le mete la culpa a @LassoGuillermo , se tendría q pedir cuentas a @Lenin por lo del estadio? Qué bajeza la d Uds",2,-1
2017-03-31 20:54:21,@anabad84,Ana Abad,8.47914988555686E+017,8,Ley anticorrupción de #Lenin  un sospechoso de delitos con una declaración juramentada ante notario es INOCENTE @Magdanifica1 @maferegas ,3,-1
2017-03-31 20:54:17,@HectorMorenoN,Héctor Moreno,8.47914970268529E+017,1,Deja de mandarme huevadas o te mando a explotar @Lenin tu no eres #Lassolucion asi que andate a la mierda.  ,1,-1
2017-03-31 20:53:46,@D2mjgkl,Guliana Gimenez,8.47914840496779E+017,7,"ni yo,ni el Padrenuestro d rodillas a punto d morirse, les creo yo a esas lacras,siempre hay algo,Lenin decia:2 pasos adelante y 1 atras.",3,-1
2017-03-31 20:53:22,@pearias1,pedro arias,8.47914742089994E+017,6,@veguichis NO al ignorante e inepto de @Lenin  ,3,-1
2017-03-31 20:52:50,@Miguel39mnop,MiguelBSC™,8.4791460770032E+017,2,Que Lenin este a tan poco de un empate técnico con lasso solo nos demuestra el graso de ignorantes borregos que tenemos en el Ecuador,0,-1
2017-03-31 20:51:44,@Historia_dice,Historia,8.47914331702514E+017,0,"""El marxismo es todopoderoso porque es cierto.""

- Lenin",5,-1
2017-03-31 20:51:12,@SoleJM85,Soledad Jimenez,8.47914194070581E+017,9,"Olvidense del ISSFA, seguro de mortuoria, prestamos..quebrado como el IESS, ese es el mensaje,es el resultado de la robolucion @FFAAECUADOR",13,-1
2017-03-31 20:51:10,@rogergarcia0178,Roger García,8.47914188236345E+017,1,"pulse por Lenin  ver si había trampa pero no esto es real @LassoGuillermo presidente eso es un hecho, ya huele a triunfo ",0,-1
2017-03-31 20:50:29,@neuromancer_la,Neuromancer,8.4791401630346E+017,38,"Vea @lenin se filtró un audio donde el que está preso por COFIEC, dice que USTED le firmó un documento donde lo dejará libre.  ",5,-1
2017-03-31 20:50:17,@kacex,ᴄʜʀɪꜱᴛɪᴀɴ,8.4791396414308E+017,0,Sigo sin comprender como Eduardo Lenin Glasnauer sigue tolerando sus amistades claramente correas y uno es el bloqueado. Una bestia.,1,-1
2017-03-31 20:48:48,@gatorunner,Franklin Lozada,8.47913593085587E+017,0,"Lenin dice que es culpa de ella por haberse metido en zonas de alto riesgo, que fue a provocar.",1,-1
2017-03-31 20:47:24,@PatricioAuthor,GPV,8.4791323872983E+017,1,"Si Ecuador vota por seguir con el socialismo XXI ante la evidencia de la catástrofe y calamidad en Venezuela, quedaremos de estúpidos.",2,-1
2017-03-31 20:47:10,@acii_ec,acii,8.4791318091973E+017,211,"Sr @Lenin, Francisco Endara preso por caso COFIEC, dice que usted le ofreció indulto, y que SU hombre del maletín es Gorky Moreno.  ",65,-1
2017-03-31 20:46:40,@jotace_llc,JC,8.47913056134988E+017,0,Eso dígaselo a Lenin q es un cobarde y no quiso debatir! Mi expresión no se compara con el nivel d Uds q es peor! Ya caerán tarde o temprano  ,1,-1
2017-03-31 20:46:15,@EfrenRocaA,Efrén Roca Álvarez,8.47912950954439E+017,2,"Lasso feriado bancario triste depresivo y derrotado según comentarios d NO T CREO, recurrir a violencia es consigna perdedores!! @Lenin",2,-1
2017-03-31 20:45:29,@sophiamabel,Sophia Mabel,8.47912757898994E+017,0,Por k amenazas paràsito.Tenle respeto a uno d nuestros mejores alcaldes k abriò tema d medio ambiente.Noes ladron ni vividor como lenin glas,1,-1
2017-03-31 20:45:27,@rositavolvio,Princesa,8.47912747761377E+017,7,"Manda a decir Lenín que por la robolución, todo se vale.  ",1,-1
2017-03-31 20:45:05,@fcoxespinosa,Fco. Xavier Espinosa,8.47912658254913E+017,1,"Oye @Lenin sabias que ya no puedes hacer campaña hoy, mmv?",4,-1
2017-03-31 20:44:30,@rosamariatorres,RosaMaría Torres,8.47912510015537E+017,0,"La gente alrededor está encantada. Es deber de un candidato a la Presidencia enseñar a la gente a respetar a los niños, no irrespetarlos.",0,-1
2017-03-31 20:43:42,@Dea5aemeleb,Frank1997 👦1925 💛,8.47912307422376E+017,0,Uyyy borregos que paso no los obliguen a votar por lenin maduro ellos no son tus borregos .... Ratas ,0,-1
2017-03-31 20:43:23,@AlFaroLibre,AlFaroLibre,8.47912230540759E+017,0,"De continuar así, con @Lenin vamos directo a Vzla.  ",0,-1
2017-03-31 20:42:20,@MisAtomicBomb,MissAtomicBomb,8.47911964034642E+017,0,Esta imagen da terror. Lenin es la misma porquería. Es continuismo. Vota por el cambio!  ,0,-1
2017-03-31 20:41:49,@xatlass,м e м х r ι ι ѕ╰☆╮,8.47911833990312E+017,1,Cada vez que veo la propaganda de Lenin Moreno me da un cáncer al ojo que hace metástasis (????),1,-1
2017-03-31 20:41:27,@alexandrafunes9,alexandra funes,8.4791174190436E+017,1,Esto metaselo en su cabeza @Lenin  ,0,-1
2017-03-31 20:40:53,@shababaty,borisvian1,8.47911598987596E+017,108,"Que le parece @Lenin como golpean a una mujer indefensa,los de #MisionTernura #Venezuela  
ASCO #MisionDemocracia jaja",20,-1
2017-03-31 20:40:21,@Afcordova99,Andres Cordova,8.47911467416515E+017,1,"Panas, les gusta la ciencia ficción, el surrealismo, la ironía y algo de comedia? Vean los twits de @Lenin El que representa 10 años de AP",0,-1
2017-03-31 20:39:46,@nicomanzur1763,Lic. DonQuixote,8.47911318279639E+017,1,"""hombre que defiende la democracia en toda su expresión."" y hace mutis por el foro con dictadura de Maduro en Vzla y autoritarismo de Correa",1,-1
2017-03-31 20:38:29,@shababaty,borisvian1,8.47910996001911E+017,3,"Vota por #Lenin si quieres vivir esto en #Ecuador
Mismo Modelo #SocialismoSigloXXI
#LeninEsVIOLENCIA
#LeninEsDICTADURA ",0,-1
2017-03-31 20:38:27,@CFKILLERPRESA,MACRISTA,8.47910985860088E+017,2,PERO SI ES UN GRAN DELINKUENTE ÉSTE LENIN...TAMOS TODOS LOKOS...ES COMO PEDIR Q VUELVA LA ASESINA DE NISMAN CFKILLER...CON FRAUDE.  ,0,-1
2017-03-31 20:36:10,@PUCARA_BRAVO,ARGENTUM,8.47910414474248E+017,5,"No dejen q Ecuador caiga en manos de las fuerzas de la oscuridad!
No VOTAR al LIBERALISMO!

Miren a Argentina",7,-1
2017-03-31 20:33:42,@pguerron,Paul Guerrón M.,8.47909792136016E+017,0,"No me sorprende en lo absoluto su comentario,  todos sabemos que al venir de personas como usted no valen para Nada @lenin basura",3,-1
2017-03-31 20:33:05,@shababaty,borisvian1,8.47909634895696E+017,2,"#Lenin apoya a esta Dictadura
#LeninEsDICTADURA
#LeninEsVIOLENCIA ",0,-1
2017-03-31 20:32:46,@alexandrafunes9,alexandra funes,8.47909557745725E+017,3,Podrá dormir tranquilo @Lenin q le dirá a sus nietos trillizos q fue parte de la destrucción de su país?  ,1,-1
2017-03-31 20:32:08,@JorgeSuarzC,Jorge Suárez,8.47909398164931E+017,0,"El efecto #MacriLasso ""CAMBIEMOS"" en #Argentina ""La represión a los sectores populares ya es una política sistemática"" @RedSolGuayas @Lenin  ",0,-1
2017-03-31 20:32:02,@maferladines_,mafer ladines,8.47909373611577E+017,0,"Las redes sociales son un caos: politiquería, AP, gente peleandose, venezuela, Maduro, golpe de estado, lasso, lenin, el CNE no nos paga ",0,-1
2017-03-31 20:30:41,@EduMon8,Montesinos,8.47909033147196E+017,2,Chavismo en plena ejecución --- @lenin  ,0,-1
2017-03-31 20:30:19,@fortizperezc,Francisco Ortiz,8.47908941988233E+017,0,@Lenin si sabe la historia de la masacre del 2 de agosto de 1810?los quiteños fueron MASACRADOS por el totalitarismo! van a hacer lo mismo?!  ,0,-1
2017-03-31 20:29:11,@verayessenia1,Yessenia,8.47908655894811E+017,6,Manotasos de ahogado. Conocen el #CasoTerrabienes hace un año y no hicieron nada. #VamosPorElCambio,1,-1
2017-03-31 20:28:27,@miguerebelde,Miguel Mateo,8.47908471576068E+017,2,"Esta agresión a mujeres disfrutan Correa, Patiño, Alvarado, Lenin, Glas, Long, Orlando Pérez, Doris, Gabriela, Rosana, Aguiñaga. Degenerados  ",0,-1
2017-03-31 20:28:26,@GonzlezAntonio,Antonio González,8.47908467025359E+017,2,En 1989 cayó el MURO DE BERLÍN... este domingo caerá el MUDO DE LENÍN!!!.,1,-1
2017-03-31 20:27:57,@MariuxiL,MARIUXI LUCERO C.,8.47908346443293E+017,9,Y unas latas de sardina para q jamás se olvide. Si o no @MashiRafael @JorgeGlas @Lenin  ,6,-1
2017-03-31 20:27:49,@SoleJM85,Soledad Jimenez,8.47908313459282E+017,1,"Parecen tácticas de exguerrileros, q candidato así fuese tan bruto como Lenin haría algo así? es obvio lo hizo AP35..veamos si alguien cree!",7,-1
2017-03-31 20:26:51,@Juansimonpc,Diego Paez Cano,8.47908069849911E+017,3,También trabaja con Lenin sra? En lo de los chistes pregunto. Malos libretistas... Como los de las propagandas.,24,-1
2017-03-31 20:24:22,@mcbadoo,mcbadoo,8.47907443548074E+017,0,"jajajajajajaja  
@LassoGuillermo cuide q no hagan FRAUDE, desde ARGENTINA sabemos q clase de tramposo es CORREA ,ellos harán cualquier COSA",0,-1
2017-03-31 20:22:51,@toniovalladares,Toño,8.47907062285836E+017,0,"Ahi estan botadas sus ""casas"" borregos @Lenin @VamosLenin @noticiasecuador @Gamanoticiasec @AntiTrollsEC ",0,-1
2017-03-31 20:18:31,@alexandrafunes9,alexandra funes,8.47905970521072E+017,0,Cobardes necesitan tantos policías para lastimar a una mujer así son sus amigos venezolanos @Lenin  ,0,-1
2017-03-31 20:18:19,@democracia2017_,Democracia Libertad,8.47905920927633E+017,1,@Lenin estamos en silencio electoral. Respete!,5,-1
2017-03-31 20:12:07,@Juanfer_81,JuanFer Guevara,8.47904358733935E+017,0,Por no votar o por votar por lenin la sanción es vivir 4 años de pobreza y acabar como Venezuela! Despierten! @LassoGuillermo presidente! ,0,-1
2017-03-31 20:10:08,@webonaditas,Webonaditas,8.47903863042695E+017,0,"Ese @Lenin según la bruja húngara saca 37,25 % nada mas...ganó @LassoGuillermo por paliza y más con la raya de Maduro",0,-1
2017-03-31 20:10:00,@aludiga,Antonio Díaz,8.47903827684667E+017,0,"La Revolución Rusa, tuiteada por Lenin, Stalin y el panadero de Petrogrado  vía @eldiarioCultura",0,-1
2017-03-31 20:09:33,@Miyibue,swimprincess,8.47903714601992E+017,0,Queriéndose parecer a Lasso. Si los Comunistas Nunca andan con las esposas..,0,-1
2017-03-31 20:07:45,@2010Compudavid,Mauricio Velasco,8.4790326056448E+017,3,Otro infame ataque contra mujeres de parde del amigo y aliado de @Lenin  ,1,-1
2017-03-31 20:05:49,@wgomezr,Msc.Walter Gomez R,8.47902775220548E+017,2,"Simple a los empresarios y no a los que se sacan el aire, comuneros, guías y trabajadores @MashiRafael @Lenin @consuemary @ap ",0,-1
2017-03-31 20:04:52,@solounidolo,Barcelonista,8.4790253791103E+017,1,Cara de rata tiene,0,-1
2017-03-31 20:02:36,@marioezb,Mario Zambrano B.,8.47901965841568E+017,1,"Wow, no sabia que si tenias la intención de votar por Lasso eras un iluminado, y si votas por Lenin eres retrasado. ",1,-1
2017-03-31 20:00:12,@Minerva39828604,Minerva,8.47901359894561E+017,0,Pregúntale tale como le vá disfrutando de la estadidad? Porqué no vive en su patria?  A qué no te atreves Lenin!!!,0,-1
2017-03-31 20:00:08,@SantiagoUlpiano,Vino Nuevo,8.47901346758001E+017,0,Estas personas están retirando propaganda del candidato Lasso lo curioso es que dejan la del candidato Lenin. Tienen uniforme del CNE  ,0,-1
2017-03-31 19:59:50,@carlosplz,Carlos Plaza Alvrz.,8.47901267364065E+017,0,pensandolo :Como el Sr Lenin es una simple ficha de este Gob Correista quizas él no sepa de las estrategias sucias de su propia campaña ,0,-1
2017-03-31 19:58:02,@richierey1,R I C H I E - R E Y,8.47900815352357E+017,1,"Lasso a hecho campaña sacando plata de su bolsillo 

Lenin Moreno a hecho campaña del bolsillo de los ecuatorianos con los fondos públicos.",2,-1
2017-03-31 19:57:57,@ferantchav46,Fernando Chavarria,8.47900793512616E+017,0,"No Lenin no. Quito Luz de América(10/8/1809), no tiene nada que ver con la luz que se genera en un incendio.  ",1,-1
2017-03-31 19:57:46,@PatricioMery,Patricio Mery Bell,8.47900747828167E+017,157,Habrá sido el mismo que colgó un peluche de un borrego? Ahora cuelgan la imagen de @lenin en quito.  ,57,-1
2017-03-31 19:57:11,@IBEROAMERICAGR,GALO RIVERA,8.47900601606447E+017,8,"LASSO PRESIDENTE, como militar retirado de las fuerzas armadas FUERA LADRONES AP.",22,-1
2017-03-31 19:55:14,@villegas8_mafer,Mafer Villegas  🎀,8.4790011204728E+017,0,"Por otro lado, quien enseñó a Ecuador a ser prepotente y ciego fue RC, pero ya se les acaba... ya se les acaaaabaaaa la patanada...",1,-1
2017-03-31 19:51:13,@ssalgadotroya,Sebastian Salgado,8.4789910064121E+017,0,"Respeta haciendo silencio por ahora con el golpe en Venezuela. Solo porque no le conviene hablar de su pana, del resto sigue en campaña.",1,-1
2017-03-31 19:50:27,@crodriguezm17,C.Rodriguez M.,8.47898909712232E+017,3,"Correa no reclamó a Maduro por estudiantes asesinados, por el hambre, dijo q lo admira, hoy no repudia su dictadura y así votarás por Lenín?",2,-1
2017-03-31 19:50:10,@MyrianeLibre,Myriane LatAm,8.47898836748173E+017,28,"Vean lo que dice Lenin....""TODO lo que sea necesario para que la revolución continúe""  Nos quieren llevar al hambre
▼  ",6,-1
2017-03-31 19:50:10,@jorgeerick29,Jorge Suarez,8.4789883655519E+017,1,Cállate sinvergüenza nosotros sabemos por quien votar y no es por tu @Lenin! ES POR @LassoGuillermo está claro estamos en democracia piensa ,0,-1
2017-03-31 19:48:36,@GuambraMajadero,Guambra Majadero,8.47898443288805E+017,0,"Un muñeco de Lenin Moreno ahorcado, le pusieron hasta las ruedas de la sillita =(",0,-1
2017-03-31 19:42:41,@RafaOrus,Rafael Orus Pino,8.47896953560195E+017,0,"La Venezuela de hoy, el Ecuador de @Lenin  ",0,-1
2017-03-31 19:42:08,@RafaOrus,Rafael Orus Pino,8.47896816804876E+017,1,"@Lenin es Venezuela, eso les encanta a estos de AP  ",0,-1
2017-03-31 19:42:04,@anaggonzalez2,Ana Gabriela,8.47896797720793E+017,1,"Sr @ppsesa explíqueme por qué me aparece esto en mi Facebook. A mí no me gusta su página, ni jamás me gustará..ni peor @Lenin @Polificcion ",3,-1
2017-03-31 19:36:49,@pavill60,Patricia,8.47895475810447E+017,2,investigue ya amenazaron a médicos #IESS  q deben tomarse foto con voto a favor de #Lenin para mantener su trabajo,0,-1
2017-03-31 19:36:39,@GamusaAlcivar,Gamusa,8.47895435301847E+017,2,"DEDICATE HABLAR DE NUESTRO CLUB, SOMOS CLUB SPORT EMELEC, NO ALIANZA PAIS, LENIN, 35, NO METAS NUESTRO CLUB EN POLITICA @SomosEmelecBDP",1,-1
2017-03-31 19:36:12,@Nenitalulu,Lú,8.47895322542166E+017,0,Y acá en Ecuador estamos a un @Lenin y un @JorgeGlas de lo mismo ,1,-1
2017-03-31 19:33:35,@artumoscoso,Arturo Moscoso M.,8.47894662056743E+017,187,Hasta Fiscal General chavista denuncia la violación orden constitucional en Venezuela. Mientras en Ecuador Lenin Moreno la defiende.,93,-1
2017-03-31 19:29:43,@LoreGonz93,Loreg,8.47893689171141E+017,0,No estamos hablando de Venezuela estamos hablando de Ecuador,1,-1
2017-03-31 19:26:05,@MidianAlfredo,Alfredo Loor Avilés,8.47892775781757E+017,0,"Para no amargarme que Lenin gane el domingo, al menos Ghost in The Shell fue un fracaso.",0,-1
2017-03-31 19:25:50,@galitoholguin,Galo Holguin,8.4789271397025E+017,0,Gente de Ecuador así Lenin Moreno defiende la ayuda que le envían desde Venezuela esto mismo puede pasar allá en #Ecuador ,0,-1
2017-03-31 19:25:32,@sersupremo16,sersupremo,8.47892638976156E+017,3,@LassoGuillermo @andrespaezec @Lenin...Que empiecen recolectando los a tunes que lanzaron los de AP en Manabí...Milagro los necesita ugrente,11,-1
2017-03-31 19:25:31,@xintriago,Xavier Intriago P.,8.47892633561309E+017,0,Ni Lenin ni los de Alianza País son pueblo! No coman cuentos! Llegaron pobres y se van con sus ctas y bolsillos lleno d dinero del pueblo!,0,-1
2017-03-31 19:24:48,@rbonifaz,Rafael Bonifaz,8.47892453818589E+017,2,Si entiendo bien. Bloquearon la cuenta de @usuariosdigital por mostrar información tributaria del candidato @Lenin ?  ,0,-1
2017-03-31 19:24:22,@pcabrera,El Bigote Inkómodo,8.4789234377259E+017,0,"HAY QUE SER TONTO
En Ecuador, Hinterlaces se llama ""Encuestas Opinión Pública""
y le da a candidato castrista (Lenin Moreno) 14% de ventaja.",0,-1
2017-03-31 19:24:20,@35NUNCAMAS,Miguel,8.47892333924422E+017,1,FUERA VENEZUELA FUERA,0,-1
2017-03-31 19:23:05,@SantiagMAndrade,Santiago M. Andrade,8.4789202081543E+017,0,Sobre todo los primeros 1000 días no verdak @Lenin  ,1,-1
2017-03-31 19:22:35,@wgomezr,Msc.Walter Gomez R,8.47891894495523E+017,9,"Como me han hecho reír esto, CREATIVIDAD A SU MAXIMO NIVEL @MashiRafael @consuemary @Lenin @CIgualdadGenero @apguayas @35PAIS @marialevicuna ",10,-1
2017-03-31 19:20:22,@djdarkv85,sybouri villa,8.47891338943226E+017,0,Empiezan a caer una a una las obras de la revolución d @MashiRafael q pensara @Lenin d estar frente a un partido tan complicado  ,1,-1
2017-03-31 19:17:36,@mi_rinkon,Licenciado_Racumin,8.47890640805483E+017,18,"Si votas por Lenin, éste será su diálogo.
#FueraGolpistasSSXXI
#VamosPorElCambio ",10,-1
2017-03-31 19:15:29,@roberto12041973,Roberto Villamar,8.47890106157498E+017,0,"Todo los recursos del pueblo al servicio del Correato.
Es evidente que LASSO PAEZ. Están sobre el candidato Correista LENIN   GLASS",0,-1
2017-03-31 19:15:06,@AlFaroLibre,AlFaroLibre,8.47890012951781E+017,1,Que nunca lleguemos a Vzla. con un gobierno violento como el compañero político de @Lenin.  ,1,-1
2017-03-31 19:13:59,@whyso_serious7,Carlos M. González,8.47889732361224E+017,0,"La campaña de Lenin consiste en contradecir los emperros Rafael. Si sigue así, termina uniéndose al #Cambio ",0,-1
2017-03-31 19:12:56,@danielmorenoz,Daniel Moreno Z,8.47889467260228E+017,0,Esto es lo que buscan @Lenin @JorgeGlas el socialismo es inútil cuando se acaba el dinero de los trabajadores ,1,-1
2017-03-31 19:12:43,@ecam47,Ernesto Andrade,8.47889413061439E+017,3,A todos los que apoyan a @Lenin ¡ABRAN LOS OJOS!  ,0,-1
2017-03-31 19:12:41,@pepeantonio73,Jose,8.47889403255161E+017,0,@LassoGE esto es @Lenin,2,-1
2017-03-31 19:10:34,@ernestovillacis,Ernesto Villacís M.,8.47888871136403E+017,0,LA DEMOCRACIA ES ANTÍPODA DE LA DICTADURA... Lenin Moreno es el continuismo de la dictadura de Rafael Correa...  ,0,-1
2017-03-31 19:09:55,@andrespaezec,Andrés Páez,8.47888708212797E+017,2,y ahi dice que es de Venezuela... ?,2,-1
2017-03-31 19:09:26,@jonathanaruiz,Jhonathan Ruiz,8.47888587043504E+017,0,las firmas para el millón de empleo terminan en las calles. Lasso juega con la gente! ,0,-1
2017-03-31 19:09:05,@ManoloLiziman24,Mr Kings.,8.47888499487498E+017,0,El cuentero ants alabando el trabajo d Lenin Moreno y ahora y ahora Salio el balboa irascible @AcaroPatty @pepin009 ,1,-1
2017-03-31 19:08:11,@Mr_Bravo74,Nino,8.47888269127897E+017,0,Dios salve a nuestro de estos míseros --->  @Lenin,1,-1
2017-03-31 19:07:50,@PatricioBolaos,Patricio Bolaños,8.47888181244682E+017,0,Esto es lo que nos espera con @Lenin  ,0,-1
2017-03-31 19:06:02,@moncayocarlos45,carlos moncayo,8.47887730084336E+017,0,"en la carretera votadas las ofertas de casa de Lenin Moreno .  cuanto engaño,cuanta mentira  ",0,-1
2017-03-31 19:02:18,@YetselEduardo,Yetsel Eduardo,8.47886789436113E+017,1,"Voten x socialismo q votaran x lo q tienen qdecir obligado, x lo qtienen qhacer oblig.y por lo que tendrán sus hijos q hacer oblig.",0,-1
