date,username,fullname,tweet_id,retweet_count,tweet,favorite_count,sentimiento
2017-03-31 21:27:25,@rvillareal2017,Rodrigo Villareal,8.47923311938023E+017,0,"Hace 10 años la RC nos devolvio el orgullo de llamarnos ecuatorianos, yo amo mi pais por eso mi voto es por @Lenin #LuchadorDeLaPazYDeLaVida",1,1
2017-03-31 21:26:56,@JorgeGlas,Jorge Glas,8.47923189258826E+017,542,"Ayer estuvimos en Quito y Cuenca ¡Cuánto cariño, cuánto apoyo, cuánta esperanza por el gobierno de @Lenin! ¡No los defraudaremos!  ",574,1
2017-03-31 21:25:19,@patriciopaezg,Patricio Paez Gracia,8.4792278039808E+017,6,#YoVotoPorLenínYJorge el domingo ratificamos el triunfo @Lenin @JorgeGlas ,8,1
2017-03-31 21:25:02,@livana2010,Killa,8.479227088517E+017,6,Solo aquel q te invita al diálogo se puede considerar un #LuchadorDeLaPazYDeLaVida y ese es @Lenin @GabrielaEsPais @JorgeGlas @GuillaumeLong,0,1
2017-03-31 21:24:14,@cedeno_juanita,Juanita Cedeño,8.47922510511448E+017,16,"Por mas Revolución, por un mejor pais para las nuevas generaciones, mi voto es por él #LuchadorDeLaPazYDeLaVida @Lenin @EcuadorPorLenin",0,1
2017-03-31 21:23:13,@olgafarfanvera,OlgaFarfánVera,8.47922255388709E+017,93,"#YoVotoPorLenínYJorge 
""camaradas vamos a ganar por un millón y medio más de votos""

¡Aquí manda el pueblo! 
@MashiRafael @JorgeGlas @Lenin  ",57,1
2017-03-31 21:21:18,@DarioRobinzo,Dario Robinzon,8.47921772997554E+017,13,"Los Jóvenes que estuvimos allí exigimos se ponga en el titular que RESPALDAMOS a @Lenin, que se cumpla la Ley #LOC @SuperComEc @PPancia",10,1
2017-03-31 21:21:04,@SoberaniaElect,SoberaníaEléctrica,8.47921714386399E+017,5,"#YoVotoPorLeninYJorge todos vamos este #2A por el triunfo contundente #BinomioDelPueblo
@Lenin
@JorgeGlas
@MashiRafael
@JaramilloMJorge ",1,1
2017-03-31 21:20:03,@silviaramos1988,silvia ramos,8.47921456625463E+017,2,Gran cierre de campaña en #LosRíosConLenín #VamosPorMas @Lenin Presidente @JorgeGlas #SomosMas @troya_marco @omarjuez @PameFalconi ,5,1
2017-03-31 21:19:16,@noemipazmino,Luisa Noemi Pazmiño,8.47921258348106E+017,83,"A diferencia de otros, .@Lenin te invita al diálogo y a la no confrontación xq es un #LuchadorDeLaPazYDeLaVida .@DefensoresRC .@dorissoliz ",0,1
2017-03-31 21:16:19,@dianatirado5,diana tirado,8.47920517285806E+017,4,cuando la inclusión se trata de cercania no de demagogia! mi voto va por ellxs #LeninPresidente,9,1
2017-03-31 21:15:49,@mDemocraciaEC,Misión Democracia,8.47920392501174E+017,284,Según 5 encuestadoras @Lenin va a ganar este 2 de abril.  Vamos a votar y cuidar nuestro voto. #MisiónDemocracia ,45,1
2017-03-31 21:15:15,@rcha1946,Ruth Herrera Aymar,8.47920247260819E+017,0,ES miseria humana. Una razón + para votar x Lenin con el lograremos que esa población tenga  derecho a la vida!,0,1
2017-03-31 21:15:07,@marioablancoa,Mario  🇦️ 🇷️ 🇹️ 🇸,8.47920216738857E+017,0,#BlogteleSUR por ilkaolivacorado | Los pueblos de América Latina estamos con Lenín Moreno  ,0,1
2017-03-31 21:14:10,@silviaramos1988,silvia ramos,8.47919977118274E+017,2,Vinceños a defender los votos @Lenin Presidente #2A día de la victoria @JorgeGlas #MayiEsTuVoz @troya_marco @PameFalconi @omarjuez ,3,1
2017-03-31 21:13:47,@DictatorsFightr,RooT,8.47919877994172E+017,8,"El país en silla de ruedas ahorcado colgando de un puente, que buena metáfora de lo que se viene con @Lenin. Gracias APes.  ",4,1
2017-03-31 21:13:32,@ecucafe,E RODRIGUEZ,8.47919817483055E+017,0,Por el amor de Dios! Este perrito es una divinura. Los buenos somos más! Somos muchos más! Dios bendiga siempre a nuestro PRESIDENTE LENIN!  ,0,1
2017-03-31 21:13:07,@JoseVicenteC35,JoseVicente Calderón,8.47919711237141E+017,49,#Quito Contigo querido @Lenin por ser un #LuchadorDeLaPazyDeLaVida @QuitoVigila @IQIniciativa @LaBarriadaUIO @LasManuelasDC @msocialcentrobv ,11,1
2017-03-31 21:12:01,@noemipazmino,Luisa Noemi Pazmiño,8.47919434727641E+017,23,Q gusto ser parte de este proceso y saludar a un gran #LuchadorDeLaPazYDeLaVida .@Lenin .@VamosLenin .@ppsesa .@MashiRafael @LeninMorenoPAIS ,0,1
2017-03-31 21:11:36,@danielyuquilema,DANIEL YUQUILEMA,8.47919331765875E+017,0,La Victoria estará dad para nuestr Presidente Lenin pero n hay q bajar los brazos saludos desd Isabela Ministro @eliecercruz @BrendaFlorGil ,1,1
2017-03-31 21:10:39,@JoseVicenteC35,JoseVicente Calderón,8.47919092417929E+017,10,Por todo el Ecuador un #LuchadorDeLaPazYDeLaVida recorrió por cada rincón del País. @ppsesa @GabrielaEsPais @pabelml @viviana_bonilla @Lenin  ,1,1
2017-03-31 21:07:11,@FerchoVillacis8,Fernando Villacis,8.4791822023757E+017,2,10 años diciendo que somos Venezuela seguimos esperando farsantes! Apoyo total @Lenin. Lasso es violencia ni un solo voto!  ,4,1
2017-03-31 21:07:11,@reychris6,Christian Berrezueta,8.47918218907964E+017,23,"Imagino que,alguien,en su reducido cerebro piensa que nunca le puede pasar algo así,#Lenin es el mejor y será nuestro Presidente  ",6,1
2017-03-31 21:06:50,@JoseVicenteC35,JoseVicente Calderón,8.47918130559156E+017,13,Ecuador requiere un presidente que sea #LuchadorDeLaPazYDeLaVida @FredJaen_ @PatriaParaTodxs @DiegoBarrazuet1 @kevinhurlt @ELMANTIS1 @Lenin  ,0,1
2017-03-31 21:06:38,@FrenteFuturoAz,Frente Pa Futuro Az,8.47918078172299E+017,18,"Somos jóvenes y buscamos mejorar la historia del país para continuar con un buen presente.
@Lenin @jcristoballoret @ealbornozv @mfespinosaEC ",10,1
2017-03-31 21:06:33,@noemipazmino,Luisa Noemi Pazmiño,8.47918060841431E+017,32,"Por tu compromiso con la gente q estuvo excluida, te convertiste en un #LuchadorDeLaPazYDeLaVida .@Lenin .@PatricioMery .@MashiRafael ",3,1
2017-03-31 21:06:08,@BlancaArguelloT,Blanca Arguello,8.47917952708075E+017,6,"@Lenin fue claro somos PAZ, la miseria humana no va a cambiar nuestro objetivo el #2A #LeninPresidente",6,1
2017-03-31 21:05:21,@EfrenRocaA,Efrén Roca Álvarez,8.47917756993372E+017,3,"@Lenin es paz, pueblo y justicia social Lasso feriado bancario es violencia, racista y antipueblo. Gracias X tu voto!! @PSocialistaEc ",1,1
2017-03-31 21:04:46,@CarlosAndres10_,CarlosAndresAlcivar,8.47917609538507E+017,4,"Tranquilo hermano, el domingo los derrotaremos una vez más con infinito amor, a diferencia de ellos.",7,1
2017-03-31 21:04:13,@thanyapatricia,TPHC,8.47917472007283E+017,0,"Hay qué ver después del 24 de Mayo cuando @Lenin tome nuestro mandato.
Estoy segura,tendremos un justo interés y la Banca seguirá adelante!",0,1
2017-03-31 21:04:12,@cecilialeon799,Chola de Miarda,8.4791746815273E+017,0,"Lasso.macri.Paez borrado odiadir del pueblo 
Lenin Moreno Garces es pueblo  ",0,1
2017-03-31 21:04:07,@GomezlRichard,Richard Gomez,8.47917445012759E+017,8,Eso es mezcla de odio y desesperación porque el pueblo no quiere un banquero de Presidente,10,1
2017-03-31 21:03:55,@JoseVicenteC35,JoseVicente Calderón,8.47917397881348E+017,30,"#LuchadorDeLaPazYDeLaVida 
Para unir a todos los ecuatorianos con el Diálogo y los consensos. 
@pabelml @XimePonceLeon @vecinomario @Lenin  ",0,1
2017-03-31 21:03:03,@vmaviles,Victor Aviles,8.4791717979014E+017,0,Ya está mi voto..! @Lenin  ,0,1
2017-03-31 21:02:47,@cecilialeon799,Chola de Miarda,8.4791711098667E+017,0,"Lenin Moreno es del pueblo
Lasso Macri es para los pelucones.galladas es una argolla  ",1,1
2017-03-31 21:02:01,@boblen1972,Robert L. Gallegos J,8.47916918359118E+017,0,"Retweeted Carlos Viteri EC (@MashiLVDE):

Los jóvenes con @Lenin un saludo desde Argentina para el pueblo... ",0,1
2017-03-31 21:01:01,@anasalmons,ana saltos,8.47916664943497E+017,15,#LuchadorDeLaPazYDeLaVida es sinónimo a @Lenin,0,1
2017-03-31 21:01:00,@teleSURtv,teleSUR TV,8.47916663542489E+017,26,#BlogteleSUR por @ilkaolivacorado | Los pueblos de América Latina estamos con Lenín Moreno  ,24,1
2017-03-31 21:00:39,@ElSapoOnline,El Sapo,8.4791657247583E+017,40,"Obviamente ellos ven que hasta los perritos están con Lenín y por eso hablan de fraude.
#TeLeoNervioso  ",20,1
2017-03-31 21:00:32,@rociojucas,Rocío Juca Salazar,8.47916544940225E+017,125,@Lenin #LuchadorDelaPazYDeLaVida el pueblo ecuatoriano de aclama viva la democrácia @EcuadorPorLenin ,8,1
2017-03-31 21:00:03,@marcelordonezr,marcelo ordoñez r,8.4791642232805E+017,3,En 2 días nuestro voto por @Lenin asegurará que nuestro derecho a la salud no será privatizada #YoVotoPorLenín #MisiónDemocracia @SomosMasEc ,2,1
2017-03-31 21:00:02,@VamosLenin,Vamos Lenín,8.47916417596875E+017,153,"En 2 días vamos a votar por el cambio verdadero, el cambio justo, el que nos conviene ¡@Lenin protegerá nuestros derechos! #MisiónDemocracia ",73,1
2017-03-31 20:58:39,@ClapCorazon,CORAZÓN DE MI PATRIA,8.4791607034617E+017,0,Los pueblos de América Latina estamos con Lenín Moreno  #VenezuelaIndestructible ,0,1
2017-03-31 20:58:28,@NachoEcu,NachoRevolución,8.47916024284557E+017,13,"#LuchadorDeLaPazYDeLaVida
@Lenin por un país de oportunidades  ",0,1
2017-03-31 20:58:00,@Mateofloresm,Mateo Flores,8.47915908437815E+017,60,"@Lenin nos demostro su enorme amor por la Patria y por los ecuatorianos, yo confio en él. LENIN #LuchadorDeLaPazYDeLaVida @MashiRafael ",27,1
2017-03-31 20:57:06,@RRL_36,100% Democrata,8.47915679135224E+017,0,"Como vnzlano le digo a los ecuatorianos si quieren un Gob como Venezuela entoces voten p @Lenin @MashiRafael ,el cambio es @LassoGuillermo",0,1
2017-03-31 20:57:02,@amandaebe1,amanda eve,8.47915666141307E+017,1,"#LuchadorDeLaPazYDeLaVida, confiamos en TI @Lenin",1,1
2017-03-31 20:56:08,@MashiLVDE,Carlos Viteri EC,8.47915437732098E+017,183,Los jóvenes con @Lenin un saludo desde Argentina para el pueblo ecuatoriano #LuchadorDeLaPazYDeLaVida ,63,1
2017-03-31 20:55:58,@alfredoponceve2,Alfredo Ponce,8.4791539383033E+017,1,"Mi futuro presidente, #LuchadorDeLaPazYDeLaVida @Lenin @MashiRafael",1,1
2017-03-31 20:55:16,@facuy,Victor Briones Facuy,8.47915218994856E+017,0,Lenin se a preocupado 100% x las personas más vulnerable d nuestra sociedad no debería ser tratado d esta manera.@BaironValleP @JuanitoFSC ,1,1
2017-03-31 20:55:10,@ClauCanizares,Claudia Cañizares,8.47915195569758E+017,0,Comparte esta página muy aclaratoria de por quién votar. #YoVotoPorLenín #MisiónDemocracia   @Lenin @SomosMasEc,0,1
2017-03-31 20:53:54,@Mateofloresm,Mateo Flores,8.47914876987101E+017,96,"La persona que nos enseño que la violencia no es el camino es @Lenin. No al pasado, yo confio en el #LuchadorDeLaPazYDeLaVida @MashiRafael ",48,1
2017-03-31 20:53:01,@MashiLVDE,Carlos Viteri EC,8.47914655158854E+017,91,"#LuchadorDeLaPazYDeLaVida 
La juventud con @Lenin un saludo desde #Bolivia ",5,1
2017-03-31 20:52:57,@soylacalor,soylacalor,8.47914638054478E+017,0,"Vota por Lenin Moreno, hombre de pueblo, defensor de los derecho de las personas con discapacidad, ES COMO TU
 #MantaFC",1,1
2017-03-31 20:52:55,@charitopiedra,Charito Piedra  👠,8.47914627530977E+017,5,Con @Lenin los Jóvenes cuidamos el planeta #LeninEsEcologíaResponsable Por eso #YoVotoPorLenin #JovenesConLenin @redverdeflex @TuiterosPAIS ,3,1
2017-03-31 20:52:23,@livana2010,Killa,8.47914491903959E+017,13,"Por tu apertura al diálogo, x tu cercanía con la gente .@Lenin eres un #LuchadorDeLaPazYDeLaVida .@VamosLenin .@Dantelo70 .@diego_vintimill ",18,1
2017-03-31 20:52:21,@Muniek_81,M. Contreras,8.4791448355312E+017,22,"#LuchadorDaLaPazYDeLaVida, caminante no hay camino, e hace camino al andar @Lenin @KuyaySapi @VamosLenin ",1,1
2017-03-31 20:52:07,@reychris6,Christian Berrezueta,8.47914427856949E+017,19,"Ventajosamente ya falta poco para que #LENIN sea presidente,y dejar de ver ese mascara que produce convulsión.El domingo todo 35  ",7,1
2017-03-31 20:50:47,@fernando92ml,Fernando Méndez L,8.47914091511509E+017,2,"Prohibido olvidar, a conocer el pasado para no cometer los mismos errores en el futuro.
.@MashiRafael
.@Lenin
.@JorgeGlas
.@SofiaEspin35 ",0,1
2017-03-31 20:50:23,@SandraV73190114,Sandra Villavicencio,8.47913988629332E+017,2,#LuchadorDeLaPazYDeLaVida @Lenin sigue en tu lucha que nosotros siempre estaremos a tu lado,1,1
2017-03-31 20:49:52,@GlasAmigos,Amigos de Jorge Glas,8.47913860078219E+017,13,Defiende el triunfo de @Lenin ! Contigo lograremos fortalecer la democracia. #MisiónDemocracia ,10,1
2017-03-31 20:49:18,@EfrenRocaA,Efrén Roca Álvarez,8.47913716561711E+017,2,"CREO @Lenin próximo presidente con 59% Lasso feriado bancario 41%, defender victoria pueblo contra pasado nefasto partidocracia Viva la RC!!  ",2,1
2017-03-31 20:48:33,@MashiLVDE,Carlos Viteri EC,8.47913530292568E+017,148,"#LuchadorDeLaPazYDeLaVida 
Los cantores latinoamericanos apoyan a @Lenin #LeonGieco ",17,1
2017-03-31 20:47:54,@NachoEcu,NachoRevolución,8.47913364827275E+017,5,"#LuchadorDeLaPazYDeLaVida
@Lenin es Paz  ",4,1
2017-03-31 20:47:02,@noemipazmino,Luisa Noemi Pazmiño,8.47913145746293E+017,52,Por la gente sencilla y humilde xq tengan igualdad de oportunidades te apoyo .@Lenin #LuchadorDeLaPazYDeLaVida .@VamosLenin .@35PAIS ,1,1
2017-03-31 20:45:40,@SoleJM85,Soledad Jimenez,8.47912802002063E+017,9,A ese Ecuador de los Alfaro Vive Carajo terroristas asesinos secuestradores.. Cuelgan monigotes de @Lenin ellos mismos toman foto y mienten!,31,1
2017-03-31 20:45:21,@GuayasEsLenin,Guayas es Lenín,8.47912723719496E+017,3,Con @Lenin vamos por un país de diálogo y acuerdos mínimos ¡El futuro no se detiene! #Misió    ,1,1
2017-03-31 20:45:17,@GuayasEsLenin,Guayas es Lenín,8.47912708532052E+017,5,Los observadores internacionales defenderán tu decisión. Confía en tu voto por @Lenin #MisiónDemocracia…  ,1,1
2017-03-31 20:45:12,@GuayasEsLenin,Guayas es Lenín,8.47912687942025E+017,4,Nuestros jóvenes tendrán universidad de calidad y apoyo total para sus emprendimientos ¡Con @Lenin avanzamos al…  ,1,1
2017-03-31 20:45:00,@JuventuPAISLoja,Juventud PAIS Loja,8.47912636733809E+017,9,#YoVotoPorLenín Un país que te impulsa al desarrollo. Este #02A a votar por @Lenin y @JorgeGlas ,5,1
2017-03-31 20:44:50,@JDdjThin,Jorge Delgado,8.47912593796813E+017,0,De ley el Sr. Lenin Moreno tiene mas acogida  ,0,1
2017-03-31 20:44:48,@x_LENINSx,LENIN SOJOS ALMEIDA,8.47912583457894E+017,0,Una gran noche de cierre de campaña en apoyo a nuestro compañero @Lenin y @JorgeGlas @MashiRafael ,0,1
2017-03-31 20:44:08,@MongoSanchezR,Montgomery Sánchez R,8.47912419301175E+017,45,"#ElOro decidió seguir construyendo un país inclusivo y democrático junto a @Lenin Vamos por ese país de diálogo

#MisionDemocracia #2A ",14,1
2017-03-31 20:43:22,@luperamirezl,Guadalupe Ramírez,8.47912225620799E+017,0,"La gente de la 35 es 7nteligente, no permitiran que se victimice como un López en Venezuela. Este es cobarde ambicioso, inmoral",1,1
2017-03-31 20:42:03,@AsocAnela,Anela,8.47911894715388E+017,6,"Esa es la pena: la oposición se ha reducido a atacar, a insultar, a denigrar #Ecuador merece un líder de diálogo como @Lenin #YoVotoPorLenín",1,1
2017-03-31 20:40:17,@viajerosecuador,Viajeros Ecuador,8.47911449930351E+017,0,"Mi voto por Lenín se RESPETA. Misión Democracia, crea tu #Twibbon en",0,1
2017-03-31 20:40:06,@DanielEsTuVoz,Daniel Mendoza,8.47911401784062E+017,0,Espectacular cierre de campaña, #Manabí ya se decidió por el #BinomioDelPueblo @Lenin @JorgeGlas ,1
2017-03-31 20:40:02,@PatriaParaTodxs,CRC INCLUSIÓN PAÍS,8.4791138484745E+017,1,Sé parte de #MisiónDemocracia en Twitter @mdemocraciaec y Facebook   únete y defendamos el voto a @Lenin  ,1,1
2017-03-31 20:39:53,@INCLUSIONRCRC,CRC INCLUSIÓN PAÍS,8.47911349862765E+017,0,Vamos a defender la voluntad de la mayoría de ecuatorianos.Nuestro voto por @Lenin se respeta #MisiónDemocracia #YoVotoPorLenín @MashiRafael ,0,1
2017-03-31 20:39:48,@VivianaBuenoS,Viviana Bueno,8.47911327523901E+017,2,Comparte esta página muy aclaratoria de por quién votar. #YoVotoPorLenín #MisiónDemocracia   @Lenin @SomosMasEc,2,1
2017-03-31 20:39:43,@noemipazmino,Luisa Noemi Pazmiño,8.4791130585607E+017,120,"Por un Ecuador de oportunidades, justo, solidario y equitativo mi voto es para @Lenin #LuchadorDeLaPazYDeLaVida @MashiRafael @GabrielaEsPais ",5,1
2017-03-31 20:39:42,@JomaraGavilanes,Jhomayra Gavilanes,8.47911301518995E+017,18,"La misiòn Manuela Espejo que ejecutaste, deja un gran legado a la nueva genración política @Lenin #LuchadorDeLaPazYDeLaVida",3,1
2017-03-31 20:39:37,@NikyNiurkagg,Niurka González Gonz,8.47911281264874E+017,0,"Que la paz y la cordura acompañe a los ecuatorianos, que el triunfo de Lenín haga eco en otras latitudes, el pueblo sabrá seguir a su líder…",1,1
2017-03-31 20:39:25,@CarchiEvelyn,Evelyn Carchi,8.47911229716931E+017,104,En 2 días nuestro voto por @Lenin asegurará que nuestro derecho a la salud no sea privatizada #YoVotoPorLenín #MisiónDemocracia @MashiRafael ,11,1
2017-03-31 20:39:15,@Muniek_81,M. Contreras,8.47911190684729E+017,17,@Lenin #LuchadorDeLaPazYDeLaVida Ecuador todos somos un sólo puño...  @alyandrade7 @MashiLVDE @noemipazmino @JoannaJativa ,1,1
2017-03-31 20:38:34,@eddie_electric1,Eddie Castillo Morán,8.47911018877551E+017,0,"Retweeted Lenín Moreno (@Lenin):

Que tu voto sea del bueno, para la salud, la equidad, el desarrollo y el... ",0,1
2017-03-31 20:38:19,@VivianaBuenoS,Viviana Bueno,8.47910952431493E+017,2,El domingo nuestros votos por @Lenin benefician a todo el pueblo. Salud no será privatizada. #YoVotoPorLenín #MisiónDemocracia @MashiRafael ,5,1
2017-03-31 20:37:45,@cendemocratico,Centro Democrático ☝,8.479108122117E+017,47,"Este domingo, nuestro líder @jimmyjairala ejercerá su voto a favor de @Lenin a las 10h00 en #Guayaquil. LEE LA NOTA:  ",20,1
2017-03-31 20:37:23,@MaferCanizares,MaFernanda Cañizares,8.4791071711846E+017,17,Seguiremos adelante con el  #LuchadorDeLaPazYDeLaVida gracias @Lenin.,0,1
2017-03-31 20:37:07,@jeferson2016s,JEFERSON SUAREZ S,8.47910649959154E+017,1,"#MisiónDemocracia, mi voto por lenin se respeta #LeninPresidenteDeTodos @CRC_InclusionRe @35PAIS @Crc_RenovacionR ",0,1
2017-03-31 20:35:56,@apguayas,Alianza PAIS Guayas,8.47910352557941E+017,18,Vamos a votar para que la Misión continúe en todo el Ecuador ¡@Lenin será el Presidente de Todos! #MisiónDemocracia ,10,1
2017-03-31 20:35:34,@jorgeusoz1,jorge usoz,8.47910262929842E+017,0,"#TodosSomosEcuadorSoy LENIN MORENO PRESIDENTE, soy la Patria Grande, soy la Dignidad, el Orgullo y la Felicidad del Pueblo Ecuaroriano  ",0,1
2017-03-31 20:34:58,@REENUEVO,JANETH LOVATON,8.47910112861733E+017,0,"EN EL CIERRE DE CAMPAÑA EN GUAYAQUIL, las casualidades no existen ...con la hija de Lenin Moreno.",0,1
2017-03-31 20:34:20,@TaniaCoronel12,Tania Soledad,8.47909951527956E+017,10,"Dios mio, que gente tan desalmada, hasta donde los lleva el odio @Lenin y todo ser humano, político o no, merece respeto #LassoEsViolencia",10,1
2017-03-31 20:34:19,@INCLUSIONRCRC,CRC INCLUSIÓN PAÍS,8.47909947086189E+017,0,En 2 días nuestro voto por @Lenin asegurará que nuestro derecho a la salud no será privatizada #YoVotoPorLenín #MisiónDemocracia @SomosMasEc ,1,1
2017-03-31 20:34:15,@EcDivinaArevalo,Ec Divina Arevalo Z.,8.47909931630068E+017,0,Nuestro voto por @Lenin se respeta #MisionDemocracia. Vamos a defender la voluntad de la mayoría de ecuatorianos #yovotoporlenin. ,0,1
2017-03-31 20:34:00,@alimjf22,ALICIA JARAMILLO,8.47909868740551E+017,58,El pueblo ecuatoriano sabe lo que quiere y necesita! Este #2A nuestro voto con mucha Fe y Convicción por @Lenin y @JorgeGlas ,54,1
2017-03-31 20:32:56,@Cubanamera_,Cubanamera,8.47909598556279E+017,0,#Lenin es el futuro del #Ecuador. Carta de intelectuales y personalidades del mundo…  ,0,1
2017-03-31 20:32:47,@paodavalos_a,Paola Dávalos ✌,8.47909560207716E+017,1," #opotrucha si son bien mudos, pero plenoooo tenemos #Lenin para largo!  ",0,1
2017-03-31 20:32:36,@manuela_saenz15,CRC MANUELITA SAÉNZ,8.47909517358772E+017,39,Por el #Ecuador inclusivo y próspero que qremos seamos parte de la #MisionDemocracia este #2A votando x nuestro Binomio @Lenin y @JorgeGlas ,33,1
2017-03-31 20:32:06,@MashiGracias,Rafico Correa,8.47909387566023E+017,40,Nuestro compa lenín Presidente de los Ecuatorianos a continuar con la revolucion @Lenin  ,18,1
2017-03-31 20:31:24,@boblen1972,Robert L. Gallegos J,8.47909214810931E+017,0,"Retweeted Lenín Moreno (@Lenin):

Este domingo cada voto construye hospitales y viviendas, crea trabajo y entrega... ",0,1
2017-03-31 20:31:24,@boblen1972,Robert L. Gallegos J,8.47909214249001E+017,0,"Retweeted Lenín Moreno (@Lenin):

Terminamos una campaña que ha sido hermosa porque hemos recorrido todo el país... ",0,1
2017-03-31 20:31:21,@boblen1972,Robert L. Gallegos J,8.4790920239589E+017,0,"Retweeted Somos Más (@SomosMasEc):

En 2 días nuestro voto por @Lenin asegurará que nuestro derecho a la salud no... ",1,1
2017-03-31 20:31:13,@HermuyCalle,Hermuy Calle Verzozi,8.47909167490884E+017,2,Gran cierre en Riobamba ! Lenin Presidente!  ,1,1
2017-03-31 20:30:18,@NESTOR_SMARTBOY,NESTOR_SMARTBOY100%,8.479089352397E+017,0,"SIN INSULTOS NI PELEAS, HAY QUE CONSOLIDAR NUESTRA DECISIÓN EN LAS URNAS....""LENÍN PRESIDENTE""!",1,1
2017-03-31 20:30:02,@mDemocraciaEC,Misión Democracia,8.47908869858881E+017,4,Vamos a defender la voluntad de la mayoría de ecuatorianos. Nuestro voto por @Lenin se respeta #MisiónDemocracia ,3,1
2017-03-31 20:30:01,@VamosLenin,Vamos Lenín,8.47908866704593E+017,163,Con @Lenin vamos por un país de diálogo y acuerdos mínimos ¡El futuro no se detiene! #MisiónDemocracia ,75,1
2017-03-31 20:29:42,@UnFerx,Astrocito  🔬,8.47908784165048E+017,0,apoyo a Lenin.,1,1
2017-03-31 20:29:21,@alyandrade7,Alexandra Simba,8.47908695770112E+017,67,"mi estimado @Lenin  en tus manos mi querido Ecuador ganará. Sin violencia, sin confrontación, con diálogo #LuchadorDeLaPazYDeLaVida",11,1
2017-03-31 20:29:09,@jgalarzaavellan,Julio Galarza A.,8.47908646814175E+017,5,.#LeninPresidenteDeTodos cierre de campaña @35PAIS #Quinindé Provincia de #Esmeraldas #LeninMoreno #LeninNosUne #leninPresidente #Ecuador ,5,1
2017-03-31 20:28:34,@MarcFalcon_,Falcón,8.47908501871571E+017,6,"No vamos a caer en provocaciones, el Ecuador es un país de PAZ  .@MashiRafael .@Lenin .@RicardoPatinoEC .@OrlandoPerezEC .@AldasJuan ",3,1
2017-03-31 20:28:34,@MarcoDVarese,Marco Daniel Varese,8.4790850165352E+017,1,"#VotoComoManaba por enseñarnos como levantarse, saldremos todos a #votar por @Lenin",1,1
2017-03-31 20:27:29,@GinaLourdes10,Gina Lourdes,8.47908228218454E+017,0,Por un Pais sin violencia Lenin Presidente  ,0,1
2017-03-31 20:27:24,@AlmaCubanita,AlmadeCuba,8.47908207901258E+017,1,"Insta #LenínMoreno a un #Ecuador unido, con trabajo y oportunidades   ",0,1
2017-03-31 20:25:35,@EcDivinaArevalo,Ec Divina Arevalo Z.,8.47907749237322E+017,0,"Atención en salud, nutrición, estimulación temprana es parte de la Misión Ternura!, #yovotoporlenin #MisionDemocracia @Lenin @MashiRafael ",0,1
2017-03-31 20:25:06,@bohemiaonline,Revista Bohemia,8.47907628558811E+017,2,"#LenínMoreno: por un #Ecuador unido, con trabajo y oportunidades    ",1,1
2017-03-31 20:25:06,@maba2050,Marlon Burbano,8.47907626772025E+017,4,La mentalidad Neoliberal esta bien arraigada en las mentes de la mayoria de los Opositores. A cuidar en SERIO @lenin @MashiRafael @JorgeGlas,3,1
2017-03-31 20:23:45,@Yolandapalmap,Yolanda Palma,8.47907289789059E+017,2,"todos a votar, Lenin a triunfar ",2,1
2017-03-31 20:23:34,@daanalfa,marco galo romero go,8.47907243492344E+017,0,NUESTRO SEÑOR nos envio AL MEJOR PRESIDENTE  y seguira bendiciendonos con LENIN Y GLASS 10 años mas GRACIAS SEÑOR por bendecirnos Amen,2,1
2017-03-31 20:22:59,@diegoayalac,DIEGO MAURICIO AYALA,8.47907095001404E+017,1,Lenin y Jorge son  Paz.,3,1
2017-03-31 20:22:17,@Dantelo70,Ecuatoriano sin paro,8.47906920732258E+017,151,"Vota por la PAZ, vota por @lenin #ElPresidenteDeTodos 
Abajo los insultos, puedes pensar distinto, pero no ofendas. SOMOS ECUATORIANOS! ",84,1
2017-03-31 20:21:38,@Afcordova99,Andres Cordova,8.47906755275366E+017,13,Gracias Lenin por ponerte en mi lugar y entender mis anhelos de un verdadero cambio. Confirmado entonces que votarás por Lasso?   ,8,1
2017-03-31 20:21:33,@p_rodriguezp,Pedro Rodriguez P.,8.47906736057045E+017,0,Yo Voto por un Ecuador de Paz.LENIN MORENO G.PRESIDENTE.Por Obras para Balzar y la Reforestación del Campo y Tecnología  ,0,1
2017-03-31 20:20:44,@kingsmanway,Elizabeth Salvador,8.47906527839179E+017,7,#GraciasHermanos de la mano hacia la victoria @Lenin @JorgeGlas @MashiRafael @ppsesa #MisionDemocracia ,3,1
2017-03-31 20:19:10,@PazminoMay,Pazmino May,8.47906134187024E+017,3,Sale a relucir la@miseria humana de esta gente !! Ojalá el día de@mañana no les pase lo mismo a ellos o a los hijos !! Por la paz Lenin !!,3,1
2017-03-31 20:14:06,@EcDivinaArevalo,Ec Divina Arevalo Z.,8.47904859433161E+017,0,Nuestro voto por @Lenin se respeta #MisionDemocracia. Vamos a defender la voluntad de la mayoría de los ecuatorianos #yovotoporlenin ,0,1
2017-03-31 20:12:47,@rarochandy,RAQUEL  RODRIGUEZ,8.47904530331316E+017,5,"Que infelices somos gente de Paz, Ecuador con Lenin",11,1
2017-03-31 20:12:15,@pamozaec,Pablo Montenegro Z.,8.47904394146402E+017,2,Vote por @Lenin  ,4,1
2017-03-31 20:12:04,@caacosta1962,Carlos A Acosta,8.47904346893427E+017,26,La campaña sucia de @Lenin orquestada por Rafael Correa ha generado duda y rechazo al candidato del cambio, pero tú decides #Ecuador ,1
2017-03-31 20:11:55,@paisderisa,El Capitan Trueno,8.47904308284838E+017,0,"Apologia de Franco es chungo, pero llevar la camiseta con LENIN es libertad de expresión. Me rio de @laSextaTV
#l6cSentenciaDeChiste",0,1
2017-03-31 20:11:36,@GanarFuencarral,Ganemos Fuencarral,8.47904231088681E+017,0,"Da la espalda a quienes piden un instituto y un centro de salud.
No quiere saber.
Está ocupada atacando al retrato de Lenin, que tiembla.  ",0,1
